<?xml version="1.0"?>

<!--

file      : examples/cxx/hybrid/filter/people.xml
author    : Boris Kolpackov <boris@codesynthesis.com>
copyright : not copyrighted - public domain

-->

<people xmlns:xsi="http://www.w3.org/2001/XMLSchema-instance"
        xsi:noNamespaceSchemaLocation="people.xsd">

  <person>
    <first-name>John</first-name>
    <last-name>Doe</last-name>
    <gender>male</gender>
    <age>32</age>
  </person>

  <person>
    <first-name>Jane</first-name>
    <last-name>Doe</last-name>
    <gender>female</gender>
    <age>28</age>
  </person>

  <person>
    <first-name>Joe</first-name>
    <last-name>Dirt</last-name>
    <gender>male</gender>
    <age>25</age>
  </person>

</people>
